<?xml version="1.0" encoding="UTF-8"?>
<!--Sample XML file generated by XMLSpy v2010 rel. 3 sp1 (x64) (http://www.altova.com)-->
<SM2013DynaRegel xmlns:xsi="http://www.w3.org/2001/XMLSchema-instance" xsi:schemaLocation="http://nav.no/dokument/ekstern/sykmelding/dynamiskregelsett/SM2013DynaRegel/v1 SM2013DynaRegel.xsd" xmlns="http://nav.no/dokument/ekstern/sykmelding/dynamiskregelsett/SM2013DynaRegel/v1"  >
	<RegelSettVersjon>3</RegelSettVersjon>
	<DynaRegel navn="Forenklet">
		<Parameter>
			<DiagGruppe_ICPC2>D70 ,D73 ,F70 ,F72 ,F73 ,H71 ,R72 ,R74 ,R75 ,R76 ,R77 ,R78 ,R80 ,R81 ,U71</DiagGruppe_ICPC2>
			<DiagGruppe_ICD10>A01[0-4]|A02[01289]|A03[012389]|A04[0-9]|A05[0123489]|A06[0-9]|A07[012389]|A08[0-5]|A09|A481|A740|B005|B085|B30[012389]|B580|H00[01]|H01[0189]|H03[018]|H04[34]|H05[01]|H10[0234589]|H13[01238]|H16[123489]|H20[01289]|H21[01234589]|H22[018]|H30[01289]|H32[08]|H579|H66[049]|H67[018]|H7[03]0|J01[0123489]?|J02[089]?|J03[089]?|J04[012]|J050|J06[089]|J09|J1[34]|J10[018]|J11[018]|J12[01289]|J15[0-9]|J16[08]|J17[01238]|J18[01289]|J20[0-9]|J22|J32[0123489]|J36|J40|N30[0123489]|N390|U049</DiagGruppe_ICD10>
			<Tidsgruppe>lt17</Tidsgruppe>
			<Kjonn/>
			<AldersGruppe/>
		</Parameter>
		<Beskrivelse>Sykmeldinger under 16 dager med visse diagnoser</Beskrivelse>
	</DynaRegel>

	<DynaRegel navn="UtdypendeOpplysninger1">
		<Parameter>
			<DiagGruppe_ICPC2></DiagGruppe_ICPC2>
			<DiagGruppe_ICD10></DiagGruppe_ICD10>
			<Tidsgruppe>49</Tidsgruppe>
			<Kjonn/>
			<AldersGruppe/>
		</Parameter>
		<Beskrivelse>Utdypende opplysninger for sykmeldinger som  passerer 7 uker</Beskrivelse>
	</DynaRegel>	
	<DynaRegel navn="UtdypendeOpplysninger2">
		<Parameter>
			<DiagGruppe_ICPC2></DiagGruppe_ICPC2>
			<DiagGruppe_ICD10></DiagGruppe_ICD10>
			<Tidsgruppe>119</Tidsgruppe>
			<Kjonn/>
			<AldersGruppe/>
		</Parameter>
		<Beskrivelse>Utdypende opplysninger for sykmeldinger som  passerer 17 uker</Beskrivelse>
	</DynaRegel>

	<DynaRegel navn="UtdypendeOpplysninger3">
		<Parameter>
			<DiagGruppe_ICPC2></DiagGruppe_ICPC2>
			<DiagGruppe_ICD10></DiagGruppe_ICD10>
			<Tidsgruppe>273</Tidsgruppe>
			<Kjonn/>
			<AldersGruppe/>
		</Parameter>
		<Beskrivelse>Utdypende opplysninger for sykmeldinger som  passerer  39 uker</Beskrivelse>
	</DynaRegel>

	<DynaRegel navn="UtdypendeOpplysninger">
		<Parameter>
			<DiagGruppe_ICPC2></DiagGruppe_ICPC2>
			<DiagGruppe_ICD10></DiagGruppe_ICD10>
			<Tidsgruppe>49,119,273</Tidsgruppe>
			<Kjonn/>
			<AldersGruppe/>
		</Parameter>
		<Beskrivelse>Utdypende opplysninger for sykmeldinger som  passerer 7, 17 og 39 uker</Beskrivelse>
	</DynaRegel>	

	<DynaRegel navn="Symptomdiagnose">
		<Parameter>
			<DiagGruppe_ICPC2>[ABDFHKLNPRSTUWXYZ][0-2][1-9]</DiagGruppe_ICPC2>
			<DiagGruppe_ICD10></DiagGruppe_ICD10>
			<Tidsgruppe>84,273</Tidsgruppe>
			<Kjonn/>
			<AldersGruppe/>
		</Parameter>
		<Parameter>
			<DiagGruppe_ICPC2>P02,P29,A04</DiagGruppe_ICPC2>
			<DiagGruppe_ICD10></DiagGruppe_ICD10>
			<Tidsgruppe>28,196</Tidsgruppe>
			<Kjonn/>
			<AldersGruppe/>
		</Parameter>
		<Beskrivelse>Gjelder alle symptomdiagnoser ved uke 12 og 39, og i tillegg for utvalgte diagnoser i uke 4 og 28.</Beskrivelse>
	</DynaRegel>
	<DynaRegel navn="AvventendeSykmelding">
		<Parameter>
			<DiagGruppe_ICPC2></DiagGruppe_ICPC2>
			<DiagGruppe_ICD10></DiagGruppe_ICD10>
			<Tidsgruppe>lt17</Tidsgruppe>
			<Kjonn/>
			<AldersGruppe/>
		</Parameter>
		<Beskrivelse>Hvis sykefrav√¶rets varighet mindre eller lik 16 dager</Beskrivelse>
	</DynaRegel>
</SM2013DynaRegel>
